name,height,mass,hair_color,skin_color,eye_color,birth_year,gender,homeworld,created,edited,url,desc
Luke Skywalker,172,77,blond,fair,blue,19BBY,male,http://swapi.co/api/planets/1/,2014-12-09T13:50:51.644000Z,2014-12-20T21:17:56.891000Z,http://swapi.co/api/people/1/,"Luke Skywalker is a fictional character and the main protagonist of the original film trilogy of the Star Wars franchise created by George Lucas. The character, portrayed by Mark Hamill, is an important figure in the Rebel Alliance's struggle against the Galactic Empire. He is the twin brother of Rebellion leader Princess Leia Organa of Alderaan, a friend and brother-in-law of smuggler Han Solo, an apprentice to Jedi Masters Obi-Wan ""Ben"" Kenobi and Yoda, the son of fallen Jedi Anakin Skywalker (Darth Vader) and Queen of Naboo/Republic Senator Padmé Amidala and maternal uncle of Kylo Ren / Ben Solo. The now non-canon Star Wars expanded universe depicts him as a powerful Jedi Master, husband of Mara Jade, the father of Ben Skywalker and maternal uncle of Jaina, Jacen and Anakin Solo.

In 2015, the character was selected by Empire magazine as the 50th greatest movie character of all time.[2] On their list of the 100 Greatest Fictional Characters, Fandomania.com ranked the character at number 14.[3]"
C-3PO,167,75,gold,yellow,112BBY,http://swapi.co/api/planets/1/,2014-12-10T15:10:51.357000Z,2014-12-20T21:17:50.309000Z,http://swapi.co/api/people/2/,"C-3PO (/siːˈθriːpi.oʊ/) or See-Threepio is a humanoid robot character from the Star Wars franchise who appears in the original trilogy, the prequel trilogy and the sequel trilogy. Built by Anakin Skywalker, C-3PO was designed as a protocol droid intended to assist in etiquette, customs, and translation, boasting that he is ""fluent in over six million forms of communication"". Along with his astromech droid counterpart and friend R2-D2, C-3PO provides comic relief within the narrative structure of the films, and serves as a foil. Anthony Daniels has portrayed the character in all nine Star Wars cinematic films released to date, including Rogue One and the animated The Clone Wars; C-3PO and R2-D2 are the only characters to appear in every film.

Despite his oblivious nature, C-3PO has played a pivotal role in the Galaxy's history, appearing under the service of Shmi Skywalker, the Lars homestead, Padmé Amidala, Raymus Antilles, Luke Skywalker, and Leia Organa. In the majority of depictions, C-3PO's physical appearance is primarily a polished gold plating, although his appearance varies throughout the films; including the absence of metal coverings in The Phantom Menace, a dull copper plating in Attack of the Clones, a silver lower right leg introduced in A New Hope, and a red left arm in The Force Awakens.[1] C-3PO also appears frequently in the Star Wars Canon and Star Wars Legends continuities of novels, comic books, and video games, and was the protagonist in the ABC television show Droids."
R2-D2,96,32,"white, blue",red,33BBY,http://swapi.co/api/planets/8/,2014-12-10T15:11:50.376000Z,2014-12-20T21:17:50.311000Z,http://swapi.co/api/people/3/,"R2-D2 is a fictional robot character in the Star Wars franchise created by George Lucas, who appears in the original trilogy, the prequel trilogy, the sequel trilogy, and Rogue One. A small astromech droid, R2-D2 is a major character and appears in all Star Wars films to date. Throughout the course of the films, he joins or supports Padmé Amidala, Anakin Skywalker, Leia Organa, Luke Skywalker, and Obi-Wan Kenobi in various points in the saga.

English actor Kenny Baker played R2-D2 in all three original Star Wars films, and received billing credit for the character in the prequel trilogy, where Baker's role was reduced, as R2-D2 was portrayed mainly by radio controlled props and CGI models. In the sequel trilogy, Baker was credited as consultant for The Force Awakens, however Jimmy Vee also co-performed the character in some scenes. Vee later took over the role beginning in The Last Jedi.[1] R2-D2's sounds and vocal effects were created by Ben Burtt. R2-D2 was designed in artwork by Ralph McQuarrie, co-developed by John Stears and built by Tony Dyson."
Darth Vader,202,136,none,white,yellow,41.9BBY,male,http://swapi.co/api/planets/1/,2014-12-10T15:18:20.704000Z,2014-12-20T21:17:50.313000Z,http://swapi.co/api/people/4/,"Darth Vader, also known by his birth name Anakin Skywalker, is a fictional character in the Star Wars franchise.[1][2][3] Vader appears in the original film trilogy as a pivotal antagonist whose actions drive the plot, while his past as Anakin Skywalker and the story of his corruption are central to the narrative of the prequel trilogy.

The character was created by George Lucas and has been portrayed by numerous actors. His appearances span the first six Star Wars films, as well as Rogue One, and his character is heavily referenced in Star Wars: The Force Awakens. He is also an important character in the Star Wars expanded universe of television series, video games, novels, literature and comic books. Originally a Jedi prophesied to bring balance to the Force, he falls to the dark side of the Force and serves the evil Galactic Empire at the right hand of his Sith master, Emperor Palpatine (also known as Darth Sidious).[4] He is also the father of Luke Skywalker and Princess Leia Organa, secret husband of Padmé Amidala and grandfather of Kylo Ren.

Darth Vader has become one of the most iconic villains in popular culture, and has been listed among the greatest villains and fictional characters ever.[5][6] The American Film Institute listed him as the third greatest movie villain in cinema history on 100 Years... 100 Heroes and Villains, behind Hannibal Lecter and Norman Bates.[7] However, other critics consider him a tragic hero, citing his original motivations for the greater good before his fall to the dark side.[8][9]"
Leia Organa,150,49,brown,light,brown,19BBY,female,http://swapi.co/api/planets/2/,2014-12-10T15:20:09.791000Z,2014-12-20T21:17:50.315000Z,http://swapi.co/api/people/5/,"Princess Leia Organa of Alderaan (also Senator Leia Organa or General Leia Organa) is a fictional character in the Star Wars franchise, portrayed in films by Carrie Fisher. Introduced in the original Star Wars film in 1977, Leia is princess of the planet Alderaan, a member of the Imperial Senate and an agent of the Rebel Alliance. She thwarts the sinister Sith Lord Darth Vader and helps bring about the destruction of the Empire's cataclysmic superweapon, the Death Star. In The Empire Strikes Back (1980), Leia commands a Rebel base and evades Vader as she falls in love with the smuggler, Han Solo. In Return of the Jedi (1983), Leia leads the operation to rescue Han from the crime lord Jabba the Hutt, and is revealed to be Vader's daughter and the twin sister of Luke Skywalker. The prequel film Revenge of the Sith (2005) establishes that the twins' mother is Senator (and former queen) Padmé Amidala of Naboo, who dies after childbirth. Leia is adopted by Senator Bail and Queen Breha Organa of Alderaan. In The Force Awakens (2015), Leia is the founder and General of the Resistance against the First Order and has a son with Han named Ben, who goes by the name Kylo Ren.

In the original Star Wars expanded universe (1977–2014) of novels, comics and video games, which are set in an alternate continuity, Leia continues her adventures with Han and Luke after Return of the Jedi, fighting Imperial resurgences and new threats to the galaxy. She becomes the Chief of State of the New Republic and a Jedi Master, and is the mother to three children by Han: Jaina, Jacen and Anakin Solo.

One of the more popular Star Wars characters, Leia has been called a 1980s icon, a feminist hero and model for other adventure heroines. She has appeared in many derivative works and merchandising, and has been referenced or parodied in several TV shows and films. Her ""cinnamon buns"" hairstyle from Star Wars (1977) and metal bikini from Return of the Jedi have become cultural icons."
Owen Lars,178,120,"brown, grey",light,blue,52BBY,male,http://swapi.co/api/planets/1/,2014-12-10T15:52:14.024000Z,2014-12-20T21:17:50.317000Z,http://swapi.co/api/people/6/
Beru Whitesun lars,165,75,brown,light,blue,47BBY,female,http://swapi.co/api/planets/1/,2014-12-10T15:53:41.121000Z,2014-12-20T21:17:50.319000Z,http://swapi.co/api/people/7/
R5-D4,97,32,"white, red",red,http://swapi.co/api/planets/1/,2014-12-10T15:57:50.959000Z,2014-12-20T21:17:50.321000Z,http://swapi.co/api/people/8/
Biggs Darklighter,183,84,black,light,brown,24BBY,male,http://swapi.co/api/planets/1/,2014-12-10T15:59:50.509000Z,2014-12-20T21:17:50.323000Z,http://swapi.co/api/people/9/,"Rogue Squadron is a starfighter squadron in the Star Wars franchise. Many surviving members of Red Squadron, the X-wing attack force that Luke Skywalker joins during the Battle of Yavin in Star Wars Episode IV: A New Hope (1977), later join Rogue Squadron. The squadron appears in The Empire Strikes Back (1980) as Rogue Group. In the 2016 film Rogue One, Rebel fighters on a suicide mission to steal the plans for the Death Star self-identify as ""Rogue One"", a possible precursor to Rogue Squadron.[1]

Rogue Squadron is prominently featured in the comic book series Star Wars: X-wing, the ten-volume novel series Star Wars: X-wing, and the video game series Star Wars: Rogue Squadron. The unit is depicted as consisting of ""the best pilots and the best fighters"".[2]"
Obi-Wan Kenobi,182,77,"auburn, white",fair,blue-gray,57BBY,male,http://swapi.co/api/planets/20/,2014-12-10T16:16:29.192000Z,2014-12-20T21:17:50.325000Z,http://swapi.co/api/people/10/,"Obi-Wan ""Ben"" Kenobi is a fictional character in the Star Wars franchise. Within the original trilogy he is portrayed by Sir Alec Guinness, while in the prequel trilogy a younger version of the character is portrayed by Ewan McGregor. In the original trilogy, he is a mentor to Luke Skywalker, to whom he introduces the ways of the Jedi. In the prequel trilogy, he is a master and friend to Anakin Skywalker. He is frequently featured as a main character in various other Star Wars media.

Sir Alec Guinness's portrayal of Obi-Wan in the original Star Wars (1977) remains the only time an actor has received an Oscar nomination (Best Supporting Actor) for acting in a Star Wars film."
Anakin Skywalker,188,84,blond,fair,blue,41.9BBY,male,http://swapi.co/api/planets/1/,2014-12-10T16:20:44.310000Z,2014-12-20T21:17:50.327000Z,http://swapi.co/api/people/11/,"Darth Vader, also known by his birth name Anakin Skywalker, is a fictional character in the Star Wars franchise.[1][2][3] Vader appears in the original film trilogy as a pivotal antagonist whose actions drive the plot, while his past as Anakin Skywalker and the story of his corruption are central to the narrative of the prequel trilogy.

The character was created by George Lucas and has been portrayed by numerous actors. His appearances span the first six Star Wars films, as well as Rogue One, and his character is heavily referenced in Star Wars: The Force Awakens. He is also an important character in the Star Wars expanded universe of television series, video games, novels, literature and comic books. Originally a Jedi prophesied to bring balance to the Force, he falls to the dark side of the Force and serves the evil Galactic Empire at the right hand of his Sith master, Emperor Palpatine (also known as Darth Sidious).[4] He is also the father of Luke Skywalker and Princess Leia Organa, secret husband of Padmé Amidala and grandfather of Kylo Ren.

Darth Vader has become one of the most iconic villains in popular culture, and has been listed among the greatest villains and fictional characters ever.[5][6] The American Film Institute listed him as the third greatest movie villain in cinema history on 100 Years... 100 Heroes and Villains, behind Hannibal Lecter and Norman Bates.[7] However, other critics consider him a tragic hero, citing his original motivations for the greater good before his fall to the dark side.[8][9]"
Wilhuff Tarkin,180,"auburn, grey",fair,blue,64BBY,male,http://swapi.co/api/planets/21/,2014-12-10T16:26:56.138000Z,2014-12-20T21:17:50.330000Z,http://swapi.co/api/people/12/,"Governor Wilhuff ""Grand Moff"" Tarkin, is a fictional character in the Star Wars franchise, first portrayed by Peter Cushing in the 1977 film Star Wars. He is the commander of the Death Star, the Galactic Empire's dwarf planet-sized super weapon. The character has been called ""one of the most formidable villains in Star Wars history.""[1]"
Chewbacca,228,112,brown,blue,200BBY,male,http://swapi.co/api/planets/14/,2014-12-10T16:42:45.066000Z,2014-12-20T21:17:50.332000Z,http://swapi.co/api/people/13/,"Chewbacca (/tʃuːˈbɑːkə/), nicknamed ""Chewie"", is a fictional character in the Star Wars franchise. He is a Wookiee, a tall, hirsute biped and intelligent species from the planet Kashyyyk. Chewbacca is the loyal friend and first mate of Han Solo, and serves as co-pilot on Solo's spaceship, the Millennium Falcon.[1] Within the films of the main saga, Chewbacca is portrayed by Peter Mayhew in the Star Wars on Episodes from III to VIII (Mayhew shares the role with his body double Joonas Suotamo on Episode VII and VIII). Suotamo took over the role alone in Solo: A Star Wars Story. The character has also appeared on television, books, comics, and video games."
Han Solo,180,80,brown,fair,brown,29BBY,male,http://swapi.co/api/planets/22/,2014-12-10T16:49:14.582000Z,2014-12-20T21:17:50.334000Z,http://swapi.co/api/people/14/,"Han Solo is a character in the Star Wars franchise. In the original film trilogy, Han and his co-pilot, Chewbacca, became involved in the Rebel Alliance's struggle against the Galactic Empire. During the course of the Star Wars narrative, he becomes a chief figure in the Alliance and succeeding galactic governments. Star Wars creator George Lucas described the character as ""a loner who realizes the importance of being part of a group and helping for the common good"".[2] Harrison Ford portrayed the character in the original Star Wars trilogy as well as The Force Awakens. Alden Ehrenreich will portray a young Han Solo in Solo: A Star Wars Story."
Greedo,173,74,green,black,44BBY,male,http://swapi.co/api/planets/23/,2014-12-10T17:03:30.334000Z,2014-12-20T21:17:50.336000Z,http://swapi.co/api/people/15/,"Greedo (or Greedo the Young) is a fictional character from the Star Wars franchise. He is portrayed by Paul Blake as well as Maria De Aragon in some close-in pickup shots in Star Wars (1977). The character is part of a fan controversy known as ""Han shot first""."
Jabba Desilijic Tiure,175,"1,358","green-tan, brown",orange,600BBY,hermaphrodite,http://swapi.co/api/planets/24/,2014-12-10T17:11:31.638000Z,2014-12-20T21:17:50.338000Z,http://swapi.co/api/people/16/,"Jabba Desilijic Tiure,[1] commonly known as Jabba the Hutt, is a fictional character and an antagonist in the Star Wars franchise created by George Lucas. He is depicted as a large, slug-like[2] alien. His appearance has been described by film critic Roger Ebert as a cross between a toad and the Cheshire Cat.[3]

In the original theatrical releases of the original Star Wars trilogy, Jabba the Hutt first appeared in Return of the Jedi (1983), though he is mentioned in Star Wars (1977) and The Empire Strikes Back (1980), and a previously deleted scene involving Jabba the Hutt was added to the 1997 theatrical re-release and subsequent home media releases of Star Wars. Jabba is introduced as the de facto leader of the Desilijic-Hutt Cartel, and the most powerful crime boss on Tatooine, who has a bounty on Han Solo's head. Jabba employs a retinue of career criminals, bounty hunters, smugglers, assassins and bodyguards to operate his criminal empire. He keeps a host of entertainers at his disposal at his palace: slaves, droids and alien creatures. Jabba has a grim sense of humor, an insatiable appetite, and affinities for gambling, slave girls, and torture.[1]

The character was incorporated into the Star Wars merchandising campaign that corresponded with the theatrical release of Return of the Jedi. Besides the films, Jabba the Hutt is featured in Star Wars Legends literature. Jabba the Hutt's image has since played an influential role in popular culture, particularly in the United States. The name is used as a satirical literary device and a political caricature to underscore negative qualities such as morbid obesity and corruption.[4][5]"
Wedge Antilles,170,77,brown,fair,hazel,21BBY,male,http://swapi.co/api/planets/22/,2014-12-12T11:08:06.469000Z,2014-12-20T21:17:50.341000Z,http://swapi.co/api/people/18/,"Wedge Antilles is a fictional character in the Star Wars franchise. He is a supporting character portrayed by Denis Lawson in the original Star Wars trilogy.[1] Antilles is a starfighter pilot for the Rebel Alliance, and founded Rogue Squadron with his friend Luke Skywalker. Wedge is notable for being the only Rebel pilot to have survived both attack runs on the Death Stars at the battles of Yavin and Endor.[1] He also appears in the Star Wars expanded universe, most notably as the lead character in most of the X-Wing novels."
Jek Tono Porkins,180,110,brown,fair,blue,male,http://swapi.co/api/planets/26/,2014-12-12T11:16:56.569000Z,2014-12-20T21:17:50.343000Z,http://swapi.co/api/people/19/
Yoda,66,17,white,green,brown,896BBY,male,http://swapi.co/api/planets/28/,2014-12-15T12:26:01.042000Z,2014-12-20T21:17:50.345000Z,http://swapi.co/api/people/20/,"Yoda is a fictional character in the Star Wars franchise created by George Lucas, first appearing in the 1980 film The Empire Strikes Back. In the original films, he trains Luke Skywalker to fight against the Galactic Empire. In the prequel films, he serves as the Grand Master of the Jedi Order and as a high-ranking general of Clone Troopers in the Clone Wars. Following his death in Return of the Jedi at the age of 900, Yoda was the oldest living character in the Star Wars franchise in canon, until the introduction of Maz Kanata in Star Wars: The Force Awakens."
Palpatine,170,75,grey,pale,yellow,82BBY,male,http://swapi.co/api/planets/8/,2014-12-15T12:48:05.971000Z,2014-12-20T21:17:50.347000Z,http://swapi.co/api/people/21/,"Sheev Palpatine[3], also known as Darth Sidious and The Emperor, is a fictional character and one of the primary antagonists of the Star Wars franchise,[4] mainly portrayed by Ian McDiarmid. In the original trilogy, he is depicted as the aged, pale-faced and cloaked Emperor of the Galactic Empire and the master of Darth Vader. In the prequel trilogy, he is portrayed as a charismatic Senator from Naboo who uses deception and political manipulation to rise to the position of Supreme Chancellor of the Galactic Republic, and then reorganizes the Republic into the Galactic Empire, with himself as Emperor.

Though outwardly appearing to be a well-intentioned public servant and supporter of democracy prior to becoming Emperor,[5] he is actually Darth Sidious, the Dark Lord of the Sith – a cult of practitioners of the dark side of the Force previously thought to have been extinct in the Star Wars galaxy for a millennium.[5] As Sidious, he instigates the Clone Wars, nearly destroys the Jedi, and transforms the Republic into the Empire. He also manipulates Jedi Knight Anakin Skywalker into turning to the dark side and serving at his side as Darth Vader. Palpatine's reign is brought to an end when Vader kills him to save his son, Luke Skywalker.

Since the initial theatrical run of Return of the Jedi, Palpatine has become a widely recognized popular culture symbol of evil, sinister deception, dictatorship, tyranny, and the subversion of democracy."
Boba Fett,183,78.2,black,fair,brown,31.5BBY,male,http://swapi.co/api/planets/10/,2014-12-15T12:49:32.457000Z,2014-12-20T21:17:50.349000Z,http://swapi.co/api/people/22/,"Boba Fett is a fictional character in the Star Wars franchise. In The Empire Strikes Back and Return of the Jedi, he is a bounty hunter hired by Darth Vader and also employed by Jabba the Hutt. He was also added briefly to the original film Star Wars when the film was digitally remastered. Star Wars: Episode II – Attack of the Clones establishes his origin as an unaltered clone of the bounty hunter Jango Fett raised as his son. He also appears in several episodes of Star Wars: The Clone Wars cartoon series which further describes his growth as a villain in the Star Wars universe. His aura of danger and mystery has created a cult following for the character."
IG-88,200,140,none,metal,red,15BBY,none,http://swapi.co/api/planets/28/,2014-12-15T12:51:10.076000Z,2014-12-20T21:17:50.351000Z,http://swapi.co/api/people/23/
Bossk,190,113,none,green,red,53BBY,male,http://swapi.co/api/planets/29/,2014-12-15T12:53:49.297000Z,2014-12-20T21:17:50.355000Z,http://swapi.co/api/people/24/
Lando Calrissian,177,79,black,dark,brown,31BBY,male,http://swapi.co/api/planets/30/,2014-12-15T12:56:32.683000Z,2014-12-20T21:17:50.357000Z,http://swapi.co/api/people/25/,"Lando Calrissian is a fictional character in the Star Wars franchise. He is portrayed by Billy Dee Williams in The Empire Strikes Back and Return of the Jedi, and will be played by Donald Glover in the upcoming standalone film, Solo: A Star Wars Story.[1] He also appears frequently in the Star Wars expanded universe of novels, comic books and video games, including a series of novels in which he is the protagonist."
Lobot,175,79,none,light,blue,37BBY,male,http://swapi.co/api/planets/6/,2014-12-15T13:01:57.178000Z,2014-12-20T21:17:50.359000Z,http://swapi.co/api/people/26/
Ackbar,180,83,none,brown mottle,orange,41BBY,male,http://swapi.co/api/planets/31/,2014-12-18T11:07:50.584000Z,2014-12-20T21:17:50.362000Z,http://swapi.co/api/people/27/
Mon Mothma,150,auburn,fair,blue,48BBY,female,http://swapi.co/api/planets/32/,2014-12-18T11:12:38.895000Z,2014-12-20T21:17:50.364000Z,http://swapi.co/api/people/28/
Arvel Crynyd,brown,fair,brown,male,http://swapi.co/api/planets/28/,2014-12-18T11:16:33.020000Z,2014-12-20T21:17:50.367000Z,http://swapi.co/api/people/29/
Wicket Systri Warrick,88,20,brown,brown,brown,8BBY,male,http://swapi.co/api/planets/7/,2014-12-18T11:21:58.954000Z,2014-12-20T21:17:50.369000Z,http://swapi.co/api/people/30/
Nien Nunb,160,68,none,grey,black,male,http://swapi.co/api/planets/33/,2014-12-18T11:26:18.541000Z,2014-12-20T21:17:50.371000Z,http://swapi.co/api/people/31/,"Nien Nunb is a fictional character in the Star Wars franchise. Introduced in the 1983 film Return of the Jedi, he was brought to life both as a puppet and a costumed actor during the film. Nunb was puppeteered by Mike Quinn and was portrayed by Richard Bonehill in wide shots. The character was voiced by Kipsang Rotich, a Kenyan student who spoke in his native Kalenjin language, as well as in the Kikuyu language. Quinn and Rotich returned to the role for the 2015 film Star Wars: The Force Awakens, with the former confirmed for the 2017 film Star Wars: The Last Jedi.

Within the fictional Star Wars universe, Nien Nunb was an arms dealer of the Sullustan species who joined the Alliance to Restore the Republic during the Galactic Civil War. Three decades later, Nunb was a starfighter pilot in the Resistance. He fought in the First Order–Resistance conflict, including the Battle of Starkiller Base."
Qui-Gon Jinn,193,89,brown,fair,blue,92BBY,male,http://swapi.co/api/planets/28/,2014-12-19T16:54:53.618000Z,2014-12-20T21:17:50.375000Z,http://swapi.co/api/people/32/,"Qui-Gon Jinn is a fictional character in the Star Wars franchise, portrayed by Liam Neeson as the main protagonist of the 1999 film Star Wars: Episode I – The Phantom Menace."
Nute Gunray,191,90,none,mottled green,red,male,http://swapi.co/api/planets/18/,2014-12-19T17:05:57.357000Z,2014-12-20T21:17:50.377000Z,http://swapi.co/api/people/33/
Finis Valorum,170,blond,fair,blue,91BBY,male,http://swapi.co/api/planets/9/,2014-12-19T17:21:45.915000Z,2014-12-20T21:17:50.379000Z,http://swapi.co/api/people/34/
Jar Jar Binks,196,66,none,orange,orange,52BBY,male,http://swapi.co/api/planets/8/,2014-12-19T17:29:32.489000Z,2014-12-20T21:17:50.383000Z,http://swapi.co/api/people/36/,"Jar Jar Binks is a fictional character from the Star Wars saga created by George Lucas. A major character in Star Wars: Episode I – The Phantom Menace, he also has a smaller role in Episode II: Attack of the Clones, and a one-line cameo in Episode III: Revenge of the Sith, as well as a role in the television series Star Wars: The Clone Wars. The first lead computer generated character of the franchise, he has been portrayed by Ahmed Best in most of his appearances.

Jar Jar's primary role in Episode I was to provide comic relief for the audience. Upon the movie's release, he was met with an overwhelmingly negative reception from both critics and audiences, and is today considered one of the most hated characters in the history of film.[1][2]"
Roos Tarpals,224,82,none,grey,orange,male,http://swapi.co/api/planets/8/,2014-12-19T17:32:56.741000Z,2014-12-20T21:17:50.385000Z,http://swapi.co/api/people/37/
Rugor Nass,206,none,green,orange,male,http://swapi.co/api/planets/8/,2014-12-19T17:33:38.909000Z,2014-12-20T21:17:50.388000Z,http://swapi.co/api/people/38/
Ric Olié,183,brown,fair,blue,male,http://swapi.co/api/planets/8/,2014-12-19T17:45:01.522000Z,2014-12-20T21:17:50.392000Z,http://swapi.co/api/people/39/
